{
  "spec-id": "v3_schema_evolution_defaults",
  "accept": true,
  "clause": "table-spec/schema-evolution",
  "note": "append, then promote id int->long and add column score (long) with initial-default/write-default=0, then append a row omitting score, then time-travel to the pre-evolution snapshot. iceberg-schema differs across observations (evolution). initial-default backfills existing rows; write-default fills the omitted column. Row lineage (_row_id) verified against the current v3 spec before blessing.",
  "snapshots": [
    { "ordinal": 0, "parent": null, "operation": "append",
      "summary": { "total-records": 2, "added-records": 2 } },
    { "ordinal": 1, "parent": 0, "operation": "append",
      "summary": { "total-records": 3, "added-records": 1 } }
  ],
  "observations": [
    {
      "at": "v1",
      "bind": "v1",
      "iceberg-schema": [
        { "field-id": 0, "name": "__rowkey", "type": "string" },
        { "field-id": 1, "name": "id",       "type": "int" },
        { "field-id": 2, "name": "name",     "type": "string" }
      ],
      "decoded-rows": [
        { "0": { "type": "string", "value": "r1" }, "1": { "type": "int", "value": 1 }, "2": { "type": "string", "value": "ann" } },
        { "0": { "type": "string", "value": "r2" }, "1": { "type": "int", "value": 2 }, "2": { "type": "string", "value": "bob" } }
      ]
    },
    {
      "at": "latest",
      "bind": "after-evolution",
      "iceberg-schema": [
        { "field-id": 0, "name": "__rowkey", "type": "string" },
        { "field-id": 1, "name": "id",       "type": "long" },
        { "field-id": 2, "name": "name",     "type": "string" },
        { "field-id": 3, "name": "score",    "type": "long" }
      ],
      "decoded-rows": [
        { "0": { "type": "string", "value": "r1" }, "1": { "type": "long", "value": "1" }, "2": { "type": "string", "value": "ann" }, "3": { "type": "long", "value": "0" } },
        { "0": { "type": "string", "value": "r2" }, "1": { "type": "long", "value": "2" }, "2": { "type": "string", "value": "bob" }, "3": { "type": "long", "value": "0" } },
        { "0": { "type": "string", "value": "r3" }, "1": { "type": "long", "value": "3" }, "2": { "type": "string", "value": "cid" }, "3": { "type": "long", "value": "0" } }
      ]
    },
    {
      "at": "v1",
      "iceberg-schema": [
        { "field-id": 0, "name": "__rowkey", "type": "string" },
        { "field-id": 1, "name": "id",       "type": "int" },
        { "field-id": 2, "name": "name",     "type": "string" }
      ],
      "decoded-rows": [
        { "0": { "type": "string", "value": "r1" }, "1": { "type": "int", "value": 1 }, "2": { "type": "string", "value": "ann" } },
        { "0": { "type": "string", "value": "r2" }, "1": { "type": "int", "value": 2 }, "2": { "type": "string", "value": "bob" } }
      ]
    }
  ]
}
