{
  "spec-id" : "v1_multi_append_lineage",
  "accept" : true,
  "snapshots" : [ {
    "ordinal" : 0,
    "parent" : null,
    "operation" : "append",
    "summary" : {
      "total-records" : 1,
      "added-records" : 1
    }
  }, {
    "ordinal" : 1,
    "parent" : 0,
    "operation" : "append",
    "summary" : {
      "total-records" : 3,
      "added-records" : 2
    }
  }, {
    "ordinal" : 2,
    "parent" : 1,
    "operation" : "append",
    "summary" : {
      "total-records" : 4,
      "added-records" : 1
    }
  } ],
  "observations" : [ {
    "at" : "latest",
    "iceberg-schema" : [ {
      "field-id" : 0,
      "name" : "__rowkey",
      "type" : "string"
    }, {
      "field-id" : 1,
      "name" : "id",
      "type" : "long"
    }, {
      "field-id" : 2,
      "name" : "val",
      "type" : "string"
    } ],
    "decoded-rows" : [ {
      "0" : {
        "type" : "string",
        "value" : "r4"
      },
      "1" : {
        "type" : "long",
        "value" : "4"
      },
      "2" : {
        "type" : "string",
        "value" : "d"
      }
    }, {
      "0" : {
        "type" : "string",
        "value" : "r2"
      },
      "1" : {
        "type" : "long",
        "value" : "2"
      },
      "2" : {
        "type" : "string",
        "value" : "b"
      }
    }, {
      "0" : {
        "type" : "string",
        "value" : "r3"
      },
      "1" : {
        "type" : "long",
        "value" : "3"
      },
      "2" : {
        "type" : "string",
        "value" : "c"
      }
    }, {
      "0" : {
        "type" : "string",
        "value" : "r1"
      },
      "1" : {
        "type" : "long",
        "value" : "1"
      },
      "2" : {
        "type" : "string",
        "value" : "a"
      }
    } ]
  } ]
}
