{
  "spec-id" : "v1_time_travel_ordinal",
  "accept" : true,
  "snapshots" : [ {
    "ordinal" : 0,
    "parent" : null,
    "operation" : "append",
    "summary" : {
      "total-records" : 1,
      "added-records" : 1
    }
  }, {
    "ordinal" : 1,
    "parent" : 0,
    "operation" : "append",
    "summary" : {
      "total-records" : 2,
      "added-records" : 1
    }
  } ],
  "observations" : [ {
    "at" : "after-first",
    "bind" : "after-first",
    "iceberg-schema" : [ {
      "field-id" : 0,
      "name" : "__rowkey",
      "type" : "string"
    }, {
      "field-id" : 1,
      "name" : "id",
      "type" : "long"
    }, {
      "field-id" : 2,
      "name" : "val",
      "type" : "string"
    } ],
    "decoded-rows" : [ {
      "0" : {
        "type" : "string",
        "value" : "r1"
      },
      "1" : {
        "type" : "long",
        "value" : "1"
      },
      "2" : {
        "type" : "string",
        "value" : "x"
      }
    } ]
  }, {
    "at" : 0,
    "iceberg-schema" : [ {
      "field-id" : 0,
      "name" : "__rowkey",
      "type" : "string"
    }, {
      "field-id" : 1,
      "name" : "id",
      "type" : "long"
    }, {
      "field-id" : 2,
      "name" : "val",
      "type" : "string"
    } ],
    "decoded-rows" : [ {
      "0" : {
        "type" : "string",
        "value" : "r1"
      },
      "1" : {
        "type" : "long",
        "value" : "1"
      },
      "2" : {
        "type" : "string",
        "value" : "x"
      }
    } ]
  }, {
    "at" : "after-first",
    "iceberg-schema" : [ {
      "field-id" : 0,
      "name" : "__rowkey",
      "type" : "string"
    }, {
      "field-id" : 1,
      "name" : "id",
      "type" : "long"
    }, {
      "field-id" : 2,
      "name" : "val",
      "type" : "string"
    } ],
    "decoded-rows" : [ {
      "0" : {
        "type" : "string",
        "value" : "r1"
      },
      "1" : {
        "type" : "long",
        "value" : "1"
      },
      "2" : {
        "type" : "string",
        "value" : "x"
      }
    } ]
  }, {
    "at" : "latest",
    "iceberg-schema" : [ {
      "field-id" : 0,
      "name" : "__rowkey",
      "type" : "string"
    }, {
      "field-id" : 1,
      "name" : "id",
      "type" : "long"
    }, {
      "field-id" : 2,
      "name" : "val",
      "type" : "string"
    } ],
    "decoded-rows" : [ {
      "0" : {
        "type" : "string",
        "value" : "r2"
      },
      "1" : {
        "type" : "long",
        "value" : "2"
      },
      "2" : {
        "type" : "string",
        "value" : "y"
      }
    }, {
      "0" : {
        "type" : "string",
        "value" : "r1"
      },
      "1" : {
        "type" : "long",
        "value" : "1"
      },
      "2" : {
        "type" : "string",
        "value" : "x"
      }
    } ]
  } ]
}
