{
  "spec-id": "v2_read_append_timetravel",
  "accept": true,
  "clause": "table-spec/snapshots",
  "note": "read-conformance: load a checked-in v2 table (minted from v2_append_timetravel) and observe the current state. Collapses to the PR #2 read shape — a single observation, no write-side snapshots section. decoded-rows keyed by field-id (0=__rowkey, 1=id, 2=category); row order is not significant (the orchestrator sorts by __rowkey). All three implementations must decode the same bytes to this same logical result.",
  "observations": [
    {
      "at": "latest",
      "iceberg-schema": [
        { "field-id": 0, "name": "__rowkey",  "type": "string" },
        { "field-id": 1, "name": "id",        "type": "long" },
        { "field-id": 2, "name": "category",  "type": "string" }
      ],
      "decoded-rows": [
        { "0": { "type": "string", "value": "r1" }, "1": { "type": "long", "value": "1" }, "2": { "type": "string", "value": "a" } },
        { "0": { "type": "string", "value": "r2" }, "1": { "type": "long", "value": "2" }, "2": { "type": "string", "value": "b" } },
        { "0": { "type": "string", "value": "r3" }, "1": { "type": "long", "value": "3" }, "2": { "type": "string", "value": "a" } }
      ]
    }
  ]
}
